,userName,score,at,content,clean_teks,polarity_score,polarity
233,Hamzah Irawan,1,2023-11-21T17:25:18.000,"Capcutnya setiap saya mau exporst buat di simpen kenapa ga loading"" udah nunggu lama sejam eh malah ga bisa padahal memo gede terus semua game dan apk udah di hapus dan apk aku cuma ada WA dan capcut tapi kok capcutnya kek gini?!!!!!??","saya,mau,buat,tidak,sudah,nunggu,lama,tidak,gede,semua,game,aplikasi,sudah,hapus,aplikasi,aku,cuma,ada,seperti",-12,negative
234,dedee citra_,3,2023-11-14T20:33:49.000,Sering banget update. Tolong dibuat offline saja pengeditannya agar stabil tanpa harus sinyal. User pengguna jg nyaman ngeditny seperti kinemster tks,"sering,terbaru,tolong,buat,saja,agar,stabil,harus,guna,nyaman,seperti,terima kasih",7,positive
235,Tito Nugraha,1,2023-10-22T10:55:32.000,Sekedar saran aja buat apk ini tolong jngn pake efek efek yang berbayar karna sangat mengganggu bagi yg baru pertama kali mnggunakan apk ini dan memakai efek yang berbayar karna otomatis video yg diedit tidak akn bisa tersimpan jika tdk berlangganan atau membayar efek tersebut dan itu sangat mengecewakan,"saran,saja,buat,aplikasi,tolong,efek,efek,yang,bayar,karena,sangat,ganggu,bagi,yang,aplikasi,efek,yang,bayar,karena,otomatis,yang,tidak,simpan,tidak,langgan,bayar,efek,itu,sangat",-27,negative
236,Rollin Manuel,2,2023-11-15T19:50:04.000,"semenjak update gabisa ngesearch lagi tulisannya selalu "" Tidak dapat dimuat. ketik untuk mencoba lagi"" udah apus download berapa kali gabisa juga tolong lah kek mana ini?","terbaru,lagi,tidak,dapat,coba,lagi,sudah,tolong,seperti",-3,negative
237,Marc!,1,2023-11-14T14:59:15.000,"setelah di update saya ingin menggunakan aplikasi ini, tapi setelah beberapa kali saya pencet malah keluar paksa, apaan bngt. menghabiskan kuota saya saja. mohon bantuannya, kenapa bisa seperti ini? sangat menggangu. saya sudah menunggu untuk mengupdate aplikasi ini, tapi apa yang saya dapat kan? apa yang di katakan mikasa memang benar ""dunia ini sangat kejam""","terbaru,saya,guna,aplikasi,saya,pencet,keluar,paksa,apa,habis,kuota,saya,saja,mohon,bantu,seperti,sangat,saya,sudah,tunggu,aplikasi,apa,yang,saya,dapat,apa,yang,kata,memang,benar,dunia,sangat,kejam",-30,negative
238,frostymons gaming,2,2023-10-13T15:56:29.000,"Sy kasi bintang dua karena ap,karena sejak capcut update Jd pro,Sy emg tidak terganggu,tapi kadang Sy tidak bisa upload suara/vid/foto dri galeri,dan kadang juga sy tidak bisa upload video dari stok video,bukan tidak bisa,tapi setiap saya upload,selalu keluar dri desain sy,tp tidak terupload,tolong diperbaiki ya,karena ini sangat sangat sangat mengganggu ketika saya sedang membuat video untuk chanel.Btw jgn lupa subscribe chanel frostymons gaming yaa","saya,kasih,dua,karena,terbaru,jadi,emg,tidak,kadang,saya,tidak,dari,kadang,saya,tidak,dari,stok,tidak,saya,keluar,dari,desain,tidak,baik,sangat,sangat,sangat,ganggu,saya,buat,jangan,lupa,game",-32,negative
239,Iffah Huriyyah,4,2023-10-30T18:22:24.000,"capcut bagus dan bisa membantu banget tapi, kok sekarang kalo mau dowload vidio nya ada tanda capcut ? padahal dowloadnya sudah pakai tanpa tanda air, padahal dulu tidak seperti ini, tolong di perbaiki lagi yaa. makasii!","bagus,bantu,kalau,mau,ada,tanda,sudah,tanda,air,tidak,seperti,tolong,baik,lagi",3,positive
240,raayy23,2,2023-09-28T17:52:34.000,"Capcut makin di update makin rusak, tiap mau milih"" foto gabisa diem di pilihan yang awal, malah relog lg ke foto terbaru, aku kan jadinya klo milib foto yang di bawah jadi kudu scroll dlu, udh gtu ke atas lagi, scroll lg, ribet bgt.","makin,terbaru,makin,rusak,mau,milih,foto,diem,pilih,yang,awal,lagi,foto,aku,jadi,kalau,foto,yang,jadi,harus,atas,lagi,lagi,ribet",-4,negative
241,Maulid Nurohman,3,2023-11-19T16:45:31.000,"iklan nya tolong di perbaiki, sering ada sound iklan saat menggunakan templat, sangat mengganggu!!!","tolong,baik,sering,ada,guna,sangat,ganggu",8,positive
242,Zaenal Abidin,2,2023-11-17T17:18:34.000,"Maaf ini setelah update kenapa ga bisa scan file musik dari perangkat yaa, sangat mengganggu pekerjaan saya.. sebelumnya baik baik saja untuk developer segera di perbaiki dong","maaf,terbaru,tidak,musik,dari,sangat,ganggu,saya,baik,baik,saja,segera,baik",5,positive
243,Seger No,1,2023-11-19T06:57:24.000,Aplikasi capcut ini.sebenernya bagus tapi ada masalah sedikit tolong dong di updet atau di perbaiki soal nya sering ada ngelag pas mau pake template tolong dong di perbaiki soalnya capcut nya bikin emosi soalnya bukanya susah pokok nya perbaiki lah,"aplikasi,bagus,ada,masalah,sedikit,tolong,baik,soal,sering,ada,pas,mau,tolong,baik,soal,emosi,soal,buka,susah,pokok,baik",17,positive
244,Bintang,2,2023-11-20T19:48:58.000,Aplikasi ya bagus bisa bikin content creator tapi kadang ada bug ya jadi bug ya tolong dihapus ya biar saya lancar bikin content creator ya ya maaf saya kasih bintang dua,"aplikasi,bagus,kadang,ada,jadi,tolong,hapus,saya,lancar,maaf,saya,kasih,dua",4,positive
245,14. M. Faiz Alvino,3,2023-11-11T21:27:01.000,Sebenarnya udah bagus tapi kok pas saya mau ngedit video atau foto kok loading nya lama nian dan GK bisa jadi tolong dibenerin kalau udah dibenerin langsung ku kasih bintang 5,"benar,sudah,bagus,pas,saya,mau,foto,lama,nian,tidak,jadi,tolong,benar,kalau,sudah,benar,langsung,kasih",20,positive
246,Jerzy Muhamad,1,2023-11-24T23:30:58.000,"sangat di sayangkan sekali di mode slow motion video nya karna patah patah, padahal di versi sebelum nya sudah mau smoth, sangat kecewa","sangat,sayang,sekali,slow,karena,patah,patah,sudah,mau,sangat",6,positive
247,Mulat Muliasih,1,2023-12-01T20:13:53.000,Baru di unduh tapi ketika membuat proyek malah videonya tidak bisa berjalan. Tolong di perbaiki karena ini untuk membuat tugas.,"buat,tidak,tolong,baik,karena,buat,tugas",-6,negative
248,Salim Produk official,5,2023-11-16T13:09:53.000,"Dengan capcut yang dulunya saya nggak jago edit video untuk content tiktok saya , sekarang jadi jago editing , hasilnya sangat bagus , thanks you creator capcut","yang,saya,tidak,jago,saya,jadi,jago,hasil,sangat,bagus,terima kasih",4,positive
249,Helen Nathania,4,2023-11-29T17:44:52.000,Aplikasi nya bagus tapi kok loading nya lama bgt ya? Kalo bisa di benerin jgn ada loading nya lagi lama bikin kesel!!!,"aplikasi,bagus,lama,kalau,jangan,ada,lagi,lama,kesel",-18,negative
250,Rsfa,2,2023-10-28T17:51:19.000,"Aplikasi ini bagus sih buat edit video tapi sekarang tuh sudah ada watermarknya jadi tidak nyaman untuk hasil download video yang kita edit, lalu jadi tidak nyaman post video di sosmed karena ada watermarknya.","aplikasi,bagus,buat,sudah,ada,jadi,tidak,nyaman,hasil,yang,lalu,jadi,tidak,nyaman,karena,ada",8,positive
251,Aisiyah Citra,3,2023-11-30T12:31:16.000,Maaf nih aki kasih begini 3 kesalahan yg aku alami 1 gebak tiba-tiba keluar sendiri 2 lama kalau mau di pasang foto pas sudah di pasang malah hasil nya jelek 3 kadang suka bilang maaf koneksi anda tidak cukup aku lebi suka yg dulu kar na baik peroses nya juga lancar tapi semakin di upload semakin aneh aku kecewa😞😞 mohon di perbaiki mohon aku sekali saja coba di perbaiki soal nya aku sering bikin ini dan karna adeku juga dia malah hapus sekali lagi minta maaf mohon di perbaiki 💔💔💝😢😢😢maaf,"maaf,kasih,begini,salah,yang,aku,alami,keluar,sendiri,lama,kalau,mau,pasang,foto,pas,sudah,pasang,hasil,jelek,kadang,suka,maaf,koneksi,anda,tidak,cukup,aku,suka,yang,baik,lancar,makin,makin,aneh,aku,mohon,baik,mohon,aku,sekali,saja,coba,baik,soal,aku,sering,karena,dia,hapus,sekali,lagi,minta,maaf,mohon,baik,maaf",30,positive
252,Sholeh Baru,3,2023-11-11T19:00:24.000,Di hp android entah lah . kadang ngeheng hasil editan seringkali hilang? Mungkin banyak paktor.dari hp. bisa dari sinyal bisa juga dari apk nya,"entah,kadang,hasil,hilang,mungkin,banyak,dari,dari,aplikasi",-2,negative
253,Ptraa prmnaa,1,2023-11-22T20:21:13.000,tolong perbaiki kenapa setiap masuk selalu lama dan lag mulu padahal sinyal bagus ruang penyimpanan masih banyak/memori tolong perbaiki secepat mungkin aj9,"tolong,baik,lama,melulu,bagus,ruang,simpan,tolong,baik,cepat,mungkin,saja",-10,negative
254,Fahrurohendah Endah,3,2023-11-18T03:44:27.000,Semenjak update pertama makin kesini makin lama kalo buka capcut harus update dulu bikin paket boros aja lah nya parah banget pengen deh ngasih reting bagus tapi aplikasi nya jelek banget,"terbaru,makin,makin,lama,kalau,buka,harus,terbaru,paket,boros,saja,parah,bagus,aplikasi,jelek",-11,negative
255,Raja Nabila Musdalifah,1,2023-11-19T09:32:14.000,"Tolong min! Aplikasinya sudah di install ulang tapi tetap ga bisa login pakai tiktok maupun Facebook, jadi sekarang ga bisa di pakai aplikasi nya","tolong,aplikasi,sudah,pasang,tetap,tidak,jadi,tidak,aplikasi",-9,negative
256,Imat Cenell24,1,2023-12-01T22:30:49.000,Ahir Ahir ini saya aplut vidio engga pernah full layar padahal saya edit seadanya engga perna pake tuh yg namanya bingkai tetapi tetap aja engga full layar tolong maksimalkan. Seperti yg sebelumnya terimakasih,"saya,saya,ada,yang,tetap,saja,tolong,maksimal,seperti,yang,terima kasih",-7,negative
257,Asiyah Pontianak,2,2023-11-28T19:43:35.000,"Ak suka aplikasi nya cuman, aplikasi agak nyebelin dikit soalnya kalo mau buat vidio nya itu klo mau masuk ke tiktok harus ada iklannya tolong diperbaiki lagi yaaaaaaaa","saya,suka,aplikasi,aplikasi,nyebelin,dikit,soal,kalau,mau,buat,itu,kalau,mau,harus,ada,tolong,baik,lagi",-13,negative
258,Yuniii,3,2023-11-24T18:44:26.000,"pls deh, ini capcut knp coba? jaringan bagus tp sebagian template nya gabisa dipake, tulisannya “tidak dapat mengunduh” paan si, bkin badmood aja","tolong,coba,jaringan,bagus,bagi,tidak,dapat,badmood,saja",-3,negative
259,Nur Khikmah,3,2023-11-24T13:10:54.000,"semenjak di update mlah tambah lemot deh ni aplikasi,gak bisa masuk ke profil coba lagi hubungkan ke internet Kya gitu terus,pdhal jaringan normal,","terbaru,tambah,lot,coba,lagi,hubung,jaringan,normal",6,positive
260,Amy Natrah,1,2023-11-21T17:01:45.000,Nge-scan musik diperangkat ponsel lama banget padahal di versi sebelumnya cepat & lancar lancar aja.,"musik,lama,cepat,lancar,lancar,saja",6,positive
261,K A M U U シ,3,2023-11-07T09:21:24.000,"pas blm update nyamann bgtt, pas udh update kek aneh gt wkwkwk, mngkin krna blm terlalu biasa sm perubahan inii. trus jg, pp pengguna capcut kok rada-rada ya? ada yg jempol tp mrip itu. pliss, keamanan disini mna? ga ngerti lgi.","pas,terbaru,pas,terbaru,seperti,aneh,wkwkwk,karena,terlalu,biasa,guna,ada,yang,jempol,itu,tolong,tidak,mengerti,lagi",10,positive
262,Wiky Musik28,1,2023-11-14T02:27:04.000,"kenapa capcut sekarang banyak bug nya sekarang saya makek aplikasi ini untuk edit video,masukan musik aja gak bisa,gambar atau video tamplat gak ada,gimna sih,g..blk","banyak,saya,aplikasi,musik,saja",-5,negative
263,Fadhil Akmal,2,2023-09-28T22:47:00.000,"Setelah update jadi suka berhenti, lemot dan ngebug jelek deh, tolong diperbaiki plisss saya inggin menggunakan nya jadi males apalagi download nya lama mb nya gede banget. Tolong di perhatikan kenyamanan konsumen. Semoga dinotis oleh devoloper, sekian bye","terbaru,jadi,suka,henti,lot,jelek,tolong,baik,saya,guna,jadi,males,lama,gede,tolong,nyaman,moga,bye",-12,negative
264,Afika Afika,1,2023-11-19T08:20:48.000,Pas aku perbarui capcut itu tidak bisa mengekspor/pertinjau itu kenapa ya ko punya aku ga bisa trs pas aku hapus capcut ny trs aku download lagi itu apk ny tidak ada di beranda hp aku itu penyababnya apa ya Tolong jelaskan untuk apk capcut?!!!!? Aku minta tanggung jawab capcut harus balikin capcut aku yang dulu+trik nya agar bisa pratinjau kembali sesudah aku download baru 3 atau 4 hari itu tidak bisa pratinjau itu kenapa ya capcut gamau tanggung jawab dasar....,"pas,aku,itu,tidak,itu,punya,aku,tidak,pas,aku,hapus,aku,lagi,itu,aplikasi,tidak,ada,beranda,aku,itu,apa,tolong,jelas,aplikasi,aku,minta,tanggung,jawab,harus,aku,yang,agar,sudah,aku,itu,tidak,itu,gamau,tanggung,jawab",-30,negative
265,Rian pebriana,3,2023-09-12T23:46:06.000,"Tolong dong layanan nya ko malah sini malah jelek, gua setiap edit ga pernah bisa di ekspor ke galeri, sekali bisa malah ga ada gambarnya item semua.ini ulasan gua pertama kali waktu pake capcut...sampe sekarang gua masih belum ngasih bintang 5 karna masih ada bug di apk ini kurang akurat kalo versi sekarang","tolong,layan,jelek,saya,tidak,sekali,tidak,ada,gambar,hitam,saya,saya,karena,ada,aplikasi,kurang,kalau",-30,negative
266,Romy Kevin,1,2023-11-18T21:54:30.000,Waduh CC nya makin hari makin rusak masa pake templat truss di simpan ee pas di pake ke udh warna abu² gitu g bisa digunakan trusss ad beberapa templat yg gw suka eee pas mau dipake udh g bisa anjirtttr sampe gw ke YouTube untuk cara mengatasi nya rupanya sama aj sampe gw update hp gw rupa nya sama aj nyesal gw padahal CC yg dulu g kaya gini udh ahh mls sama CC yg ini kalau yg dulu mahh bagus dan lancar lancar aja ko pas udh di update eee Mala tambah parah yg pencipta tolong perbaikin ni CC yaa,"waduh,makin,makin,rusak,simpan,pas,abu,guna,ada,yang,saya,suka,pas,mau,sampai,saya,atas,rupa,sama,saja,sampai,saya,terbaru,saya,rupa,sama,saja,sesal,saya,yang,kaya,malas,sama,yang,kalau,yang,mahh,bagus,lancar,lancar,saja,pas,terbaru,mala,tambah,parah,yang,tolong",2,positive
267,Rohim 65,1,2023-11-28T20:27:33.000,"Sekarang capcut tambah ngebug JD g lama untuk masuk ke apk nya meski hpnya lemot biasanya agak cepat tp sekarang tambah lama banget untuk masuk ke apk capcutny,,,,JD tolong diperbaiki lagi dong","tambah,jadi,lama,aplikasi,meski,lot,biasa,cepat,tambah,lama,aplikasi,tolong,baik,lagi",-13,negative
268,Nyong Ale Karibo,1,2023-11-20T18:31:25.000,Aplikasi jadi macet .di saat mau nambah Overlay tidak jadi..aplikasi sudah jelek..perbaiki dulu baru aku nambah ⭐,"aplikasi,jadi,mau,tidak,sudah,aku",2,positive
269,mut tee,3,2023-10-01T13:57:03.000,"untuk tools dan templatenya bagus, tapi untuk resolusinya tidak ketika ingin menyimpan video dengan resolusi sampai 2/4k, tingkat bingkai 60 dan laju bit tinggi, hasilnya tetap sama saja tidak ada perubahan, Vidio yg diedit tetap tidak jernih dan pemutaran tidak smooth","bagus,resolusi,tidak,simpan,resolusi,sampai,tingkat,tinggi,hasil,tetap,sama,saja,tidak,ada,yang,tetap,tidak,jernih,tidak",3,positive
270,Kaila Raissa Putri,5,2023-09-17T10:51:13.000,Hai kak kenapa aplikasi ini ngelag ngelag jadi saya pas atur durasi video atau foto nya jadinya tuh hitam semua gambarnya kayaknya harus mulai ulang aduh gimana dong tolong diperbaiki padahal aplikasinya udah bagus cara ngeditnyaada transisi efek dan lain-lainnya itu sudah bagus semua tapi itu jaringan saya padahal sudah bagus tapi kenapa malah tapi tambah ngelag-ngelag betul jadi saya mohon diperbaiki,"hai,aplikasi,jadi,saya,pas,atur,foto,jadi,hitam,semua,gambar,kayak,harus,mulai,aduh,tolong,baik,aplikasi,sudah,bagus,efek,itu,sudah,bagus,semua,itu,jaringan,saya,sudah,bagus,tambah,betul,jadi,saya,mohon,baik",13,positive
271,Dina Mariana,3,2023-11-17T22:15:47.000,"Kok jadi gini yaa tiap mau edit lagu pakai lirik , kalau sudah di save ..di puter lagi di galeri lirik nya selalu kepotong 😭 Hpku sampe tak restart terus ,kirain hpku yg bermasalah","jadi,mau,lagu,kalau,sudah,lagi,potong,sampai,tidak,kira,yang,masalah",-5,negative
272,akun santriwan,5,2023-11-25T09:39:58.000,"Seketika Ente Pakai CC, tiba-tiba jadi Editor Berkelas. Keren Aplikasinya, tingkatkan teruss ❤❤❤❤","jadi,aplikasi,tingkat",-2,negative
273,Ririn Santika,1,2023-11-16T14:56:36.000,"kenapa sekarang klo make template ada watermark nya walaupun udah di ekspor ke tiktok tpi tetp aja ada watermark nya, klo vid nya di potong jadi ngeblur, susah sekarang aneh jelek","kalau,ada,sudah,saja,ada,kalau,potong,jadi,susah,aneh,jelek",1,positive
274,Ramzy Albaz,1,2023-12-02T17:57:24.000,"Pas pencet pencarian itu ada tulisan"" Tidak dapat dimuat. Ketuk untuk mencoba lagi"" setiap diketuk pasti kek gtu mulu","pas,pencet,cari,itu,ada,tidak,dapat,coba,lagi,pasti,seperti,melulu",-5,negative
275,johana kp,4,2023-11-19T17:45:18.000,Bagus banget cocok buat ngedit tapi biasanya pas pake templat ngebug terus juga agak lemot tapi ini gak kalah bagus sama aplikasi edit lainnya👍🏻,"bagus,cocok,buat,biasa,pas,lot,kalah,bagus,sama,aplikasi,lain",0,neutral
276,Gaiz JayaHind,1,2023-11-19T21:31:11.000,"Aplikasi nya sangat tidak bagus jaringan nya ngelg padahl sinyal nya tidak ngelg saya beri bintang satu 1 karena aplikasi tidak bagus , Tolong di Bagus in lagi.","aplikasi,sangat,tidak,bagus,jaringan,tidak,saya,beri,satu,karena,aplikasi,tidak,bagus,tolong,bagus,lagi",-17,negative
277,vicoletta anel,1,2023-11-23T14:14:57.000,Ini setelah update.. Kenapa tidak bisa dimainkan saat mau edit video.. Padahal akan edit suara agar terpotong.. Semakin payah nih,"terbaru,tidak,main,mau,suara,agar,potong,makin",5,positive
278,YNF STORE,2,2023-11-18T07:59:26.000,Ekspor nya lama banget semenjak update padahal dulu ngekspor lirik lagu ga selama ini sekarang bisa sampai 2 menit padahal memori masi luas tolong di perbaiki lagi ya,"lama,terbaru,lagu,tidak,lama,sampai,luas,tolong,baik,lagi",-4,negative
279,YU YU,1,2023-11-20T16:44:17.000,Tolong dong ini buat aplikasi capcut di benerkan lgi saya baru saja mah ngedit tetapi saja tidah bisa trus sedang mengedit sampai ber jam2 tolong lah buat pengguna capcut di perbaikan lgi supaya tidak buang2 waktu cuma buat ngedit begini 🙏,"tolong,buat,aplikasi,lagi,saya,saja,saja,sampai,tolong,buat,guna,baik,lagi,supaya,tidak,buang,cuma,buat,begini",-29,negative
280,Firman Sinambela,1,2023-11-15T03:55:01.000,"Udah lemot,banyak bug lagi,banyak iklan nya kepencet dikit langsung pindah ke play store. asli ini aplikasi bikin naik darah","sudah,pencet,dikit,langsung,pindah,main,asli,aplikasi,naik,darah",6,positive
281,Rohadi Rohadi,5,2023-11-24T15:57:29.000,"Terimakasih, banyak. Capcut saya bisa buat video edit dengan musik dan caption. Sangat mengapresiasi dan menghibur 👍😇","terima kasih,banyak,saya,buat,musik,sangat",11,positive
282,Qila050,5,2023-11-25T21:24:16.000,ini bagus banget buat ngedit vidio atau foto saya suka tapi tolong ya admin nya kurangin ngeleg nya karna saya setiap buka capcut sering keluar sendiri tapi saya tetep kasih bintang 5 buat capcut🤗🎉🙏💐,"bagus,buat,foto,saya,suka,tolong,karena,saya,buka,sering,keluar,sendiri,saya,kasih,buat",-2,negative
283,Izzaura Kayana,1,2023-11-25T20:43:03.000,Dulu sebelum ke update biasa aja kok sekarang malahan gak bisa nambahin foto foto bebas malahan bisa nya pake foto yg ada di template capcut!,"terbaru,biasa,saja,foto,foto,bebas,foto,yang,ada",7,positive
284,Paws official,1,2023-11-21T00:28:54.000,"Turun lagi bintang! bug semakin parah! Tolong di fix, bug pada saat mengubah word art terjadi bug pada caption. Bug audio perangkat loading, bug geser audio, bug animasi.","turun,lagi,makin,parah,tolong,pada,kata,jadi,pada,geser",-12,negative
285,Mifthahul Jannah,4,2023-11-17T09:59:34.000,"Makin hari memang ditambah fitur dan berbagai ikon yang menarik tapi agak bug,saya mau template yang ini malah hilang langsung.Tolong donk min diperbaiki lagi,agar saya bisa ngedit capcut dengan mudah😃","makin,memang,tambah,lambang,yang,tarik,mau,yang,hilang,baik,saya,mudah",10,positive
286,Linda Linda,2,2023-11-18T19:35:24.000,"Capcut knp sih kok jadi gini, yang dulunya kalo mau ngedit langsung muncul ftonya sekrang kok jadi ""belum ada media"" Terus padahal penyimpanan sinyal udah bagus tolong di perbaiki","jadi,yang,kalau,mau,langsung,muncul,jadi,ada,simpan,sudah,bagus,tolong,baik",12,positive
287,agil ghani,3,2023-11-04T16:58:44.000,"Tolong dong pihak capcut, atau developer capcut benerin... Soalnya ketika saya search video/template di kolom pencarian malah ""Tidak Dapat Dimuat, Coba Lagi"" tolong di fix kan problemnya... Jadi susah nyari.","tolong,pihak,soal,saya,cari,tidak,dapat,coba,lagi,tolong,masalah,jadi,susah,mencari",-27,negative
288,Badai Pras,4,2023-11-29T14:44:07.000,Aplikasi ini bagus sangat menbantu saya mengedit atau mengerjakan tugas dengan mudah tapi aplikasi ini sering sekali macet saat mengedit jadi saya sarankan tolong di pebarui lagi biar bertambah mudah,"aplikasi,bagus,sangat,saya,tugas,mudah,aplikasi,sering,sekali,jadi,saya,saran,tolong,lagi,tambah,mudah",1,positive
289,Muhammsd al fahri Fahri,1,2023-11-11T10:39:43.000,"Makin kesini kok makin nge bug yaa Masi lumayan versi lama daripada versi sekarang Padahal jaringan lagi lancar²nya malah macet² Nggak bisa mau sesuai kan klip Nya Tolong di perbaiki dong, ditingkatkan lagi Aplikasinya Sekian terimakasih","makin,makin,lumayan,lama,jaringan,lagi,tidak,mau,sesuai,tolong,baik,tingkat,lagi,aplikasi,terima kasih",4,positive
290,Enik Zidah,4,2023-11-16T11:49:50.000,"Tolong dong ,capcut saya lag ,tiba-tiba keluar dan gabisa nyimpen template di proyek dan tiba-tiba keluar solusinya gimana yaa? Saya jadi males ngedit kalo lag🙏🙏","tolong,saya,keluar,keluar,solusi,saya,jadi,males,kalau",-15,negative
291,Munjiyah Sanusi,5,2023-11-21T19:29:18.000,"Aplikasi nya bagus terus banyak video video yang lagi trend di tiktok,dan banyak video yang aku suka,dan satu lagi gak bosen bosen ngedit video di aplikasi capcut ini kok jadi aku kasih bintang lima aja","aplikasi,bagus,banyak,yang,lagi,banyak,yang,aku,satu,lagi,aplikasi,jadi,aku,kasih,saja",-9,negative
292,Yusuf Ardabili,5,2023-11-24T09:46:58.000,"Aplikasi ini reckmended banget buat edit 2 video, dengan fitur2 yang lengkap dan kualitas video super hd. Recomended pokoknya khususnya buat yg hobbi2 edit2 tanpa ribet harus pake pc","aplikasi,buat,yang,lengkap,kualitas,super,pokok,buat,yang,ribet,harus",-9,negative
293,Ari Marselino,5,2023-11-27T02:06:22.000,Kalau saya pribadi mengatakan aplikasinya bagus serta mudah dalam penggunaannya bahkan dari segi sistem juga bagus tapi tolong diperbagus lagi kadang saya kalau lgi kirim videonya suka keluar dari apknya sendiri,"kalau,saya,kata,aplikasi,bagus,serta,mudah,dalam,guna,dari,segi,sistem,bagus,tolong,bagus,lagi,kadang,saya,kalau,lagi,kirim,suka,keluar,dari,aplikasi,sendiri",-21,negative
294,Kayana,3,2023-11-14T23:11:38.000,"Apsih ini Anjjj, Masa lgi ngedit video tiba2 kepencet sendiri yg aku lgi ngedit di bagian 03.40 tiba kepencet ke 05.00 (contoh), Pas Pake template jg error tiba2 malah muncul Gambar ini telah dihapus dri memori anda (Gambar dri templatenya) Menggangu, Selebihnya sih oke2 aja.","lagi,pencet,sendiri,yang,aku,lagi,bagi,pencet,pas,error,muncul,gambar,hapus,dari,anda,gambar,dari,lebih,oke,saja",-21,negative
295,Nabil NABIL MLOVRS,1,2023-11-22T22:19:44.000,aplikasi memuat efeknya lama bangett paling males buat ngedit padahal dulu lancar lancar aja sekarang lama banget Apa lagi pas udah bisa lambat banget gerak nya foto/vidionya,"aplikasi,efek,lama,males,buat,lancar,lancar,saja,lama,apa,lagi,pas,sudah,lambat",-6,negative
296,Realme C21y,1,2023-11-19T16:44:41.000,"Mengapa pas mau meng expor video nya ada tulisan ""cap cut"" padahal saya sudah memilih yang ""expor tanpa tanda air"" tapi sama saja masih ada tulisan cap cut nya, sangat mengecewakan sekali","pas,mau,ada,saya,sudah,pilih,yang,tanda,air,sama,saja,ada,sangat,sekali",8,positive
297,Muhammad Mustofa,1,2023-11-05T18:07:57.000,"Perlu perbaikan sistem yang sering ngebug musik dan video gak sinkron saat ngedit, waktu download juga lama.","perlu,baik,sistem,yang,sering,musik,sinkron,lama",-2,negative
298,peggy .andrian,1,2023-11-25T13:36:49.000,Bikin ga betah makin kesini pakai capcut...di update malah templatenya hilang padahal itu lebih memudahkan pengguna mengedit videonya...malah ilang...👎👎,"tidak,makin,terbaru,hilang,itu,lebih,mudah,guna,hilang",11,positive
299,Dewa Tara,1,2023-11-15T10:39:22.000,Kenapa suara musik tamplet nya kagak ada ya kok setelah update jadi nyeleneh gini...pastiin kek performa updatenya ngeselin lama lama.,"suara,musik,tidak,ada,terbaru,jadi,seperti,terbaru,ngeselin,lama,lama",-2,negative
300,sarumi indah,2,2023-11-19T21:40:45.000,"Capcut kenapa sekarang???? , suara iklan nya mengganggu banget pas ngedit template, mana gabisa di mute jadi gavisa bedain bunyi sound dan suara iklan, ihhh keselll","suara,ganggu,pas,jadi,bunyi,suara,ihhh",2,positive
301,Zurman Rivliansyah,1,2023-11-19T16:56:16.000,Terjadi BUG lagi pada saat pemindaian musik pada penyimpanan saya dengan masalah list musik tidak muncul-muncul,"jadi,lagi,pada,musik,pada,simpan,saya,masalah,musik,tidak",-19,negative
302,Habibi Abdullah,4,2023-11-16T21:53:13.000,Aplikasi apa lah update mulu tapi gpp aplikasi cap cut tetap terbaik tapi juga ada kekurangan seperti saat sudah di ekspor dan nanti kualitas video nya yg burik nya omagat,"aplikasi,apa,terbaru,melulu,aplikasi,tetap,baik,ada,kurang,seperti,sudah,nanti,kualitas,yang",-4,negative
303,Muhamad Fahriansyah,5,2023-11-13T10:48:50.000,"CapCut adalah aplikasi editing video dan pembuatan video dengan musik untuk TikTok, tidak berbayar dan mudah digunakan. Recommended banget buat editing!!","aplikasi,buat,musik,tidak,bayar,mudah,guna,buat",1,positive
304,yuyu yulianti,4,2023-11-07T15:07:10.000,"Untuk apli nya bgus² aja tpi, kadang² suka nge lag tpi sinyal ny itu bagus, kadang² juga suka keluar sendiri pas mau masuk lagi lama bet nunggu nya Tapi is oky not bad untuk saya yg suka jj wkwk. Maaf klo ada tutur kata yg kurang baik.","bagus,saja,kadang,suka,itu,bagus,kadang,suka,keluar,sendiri,pas,mau,lagi,lama,nunggu,bad,saya,yang,suka,tertawa,maaf,kalau,ada,tutur,kata,yang,kurang,baik",5,positive
305,30KN Keika,4,2023-11-24T18:06:43.000,untuk efek video udh bagus banget tetapi yang kurang mungkin efek video bisa di tambahkan dengan yang lain sama kalau bisa saat pencarian efek atau apapun itu pengen nya tu yang konsep ya tu sama yang kita mau cari,"efek,bagus,yang,kurang,mungkin,efek,tambah,yang,lain,sama,kalau,cari,efek,apa,itu,yang,sama,yang,mau,cari",-15,negative
