,userName,score,at,content,clean_teks,polarity_score,polarity
430,will,1,2023-10-05T20:18:08.000,Dulu fiturnya gratis tapi sekarang pakai langganan berbayar tiap bulan. Sangat kecewa sama aplikasi ini. Kalau bisa sekali beli fiturnya bisa di pakai seumur hidup. Jangan berlangganan mahal trus fitur biasa aja. Di apps lain sekali bayar pakai seumur hidup fitur lbh bagus dari capcut. Tolong di pertimbangan kalau gak nnti gak bakalan laku appsnya. Lbh baik pindah apps sebelah lebih murah dan gak berlangganan seprti capcut ini.sangat mahal paketnya,"gratis,langgan,bayar,bulan,sangat,sama,aplikasi,kalau,sekali,beli,umur,hidup,jangan,langgan,mahal,biasa,saja,aplikasi,lain,sekali,bayar,umur,hidup,lebih,bagus,dari,tolong,kalau,nanti,lebih,baik,pindah,aplikasi,belah,lebih,murah,langgan,seperti,mahal,paket",12,positive
431,Mas Imam,2,2023-10-05T06:42:26.000,"Sering error, tolong perbaiki lg aplikasinya. Masa saya mau cari konten keteranganya gak bisa di muat terus, udah 3x download tetep aja gal ada perubahan..","sering,error,tolong,baik,lagi,aplikasi,saya,mau,cari,sudah,saja,ada",-5,negative
432,Andika Wahyu,2,2023-09-25T06:12:31.000,"Aplikasi nya sebenarnya bagus tapi kenapa setelah update kok malah gak bisa buat masuk dan setiap masuk pasti ada tulisan ""koneksi internet anda tidak stabil"" padahal internet gw tidak ngelek sama sekali","aplikasi,benar,bagus,terbaru,buat,pasti,ada,koneksi,anda,tidak,stabil,saya,tidak,sama,sekali",5,positive
433,Aqeela Fakhira hasan,5,2023-09-20T15:04:39.000,"Aku suka dengan aplikasi ini, senang buat bikin full beat, jedag jedug dan lain2 dan bisa juga kita ngedit vidio yang kita rekam, mungkin ini bikin HP ku jadi ngeleg tapi gpp yang penting aplikasi nya bagus dan aku juga sukaa banget, aku kasih bintang 5 karena bener2 bagus banget kalian wajib download sih ini tapi ini harus online ya jadi gk bisa offline udh si segitu aja🙏☺😚","aku,suka,aplikasi,senang,buat,lain,yang,rekam,mungkin,jadi,yang,penting,aplikasi,bagus,aku,suka,aku,kasih,karena,benar,bagus,wajib,harus,jadi,tidak,segitu,saja",-11,negative
434,Farholin Devni,2,2023-10-10T17:28:18.000,Kenapa jika kita hapus aplikasinya template yang sudah di simpan jadi hilang?? semoga kedepannya aplikasi ini semakin mudah dan praktis untuk di gunakan karena template yang sudah di simpan itu bagus bagus semua,"hapus,aplikasi,yang,sudah,simpan,jadi,hilang,moga,aplikasi,makin,mudah,praktis,guna,karena,yang,sudah,simpan,itu,bagus,bagus,semua",-9,negative
435,A 915,1,2023-10-25T23:18:54.000,"Bagian Search nya itu erorr dengan tulisan ""Tidak dapat dimuat, Ketuk untuk coba lagi"" Dan saat di ketuk pun sama saja, gak terjadi apa² dan masih sama dengan tulisan seperti itu, mohon di perbaiki lagi ya","bagi,itu,error,tidak,dapat,coba,lagi,pun,sama,saja,jadi,apa,sama,seperti,itu,mohon,baik,lagi",-12,negative
436,Akmal Fikri ramadhan,5,2023-09-23T13:11:23.000,Aplikasi bagus baget. Bisa buat dj. Dan tolong tambahan font favorit. Supaya nanti pas ada pembaruan tidak acak-acakan lagi. Soalnya susah dicari...,"aplikasi,bagus,buat,tolong,tambah,supaya,nanti,pas,ada,tidak,lagi,soal,susah,cari",-13,negative
437,Ryan,5,2023-09-25T17:29:42.000,"Untuk tadi yg bilang udah cepet tuh eksportnya cuma kurang di format mp4 nya aja yang bikin file size nya gede, wajar wajar aja si menurut gw walopun kurang sempurna karena ada kelebihan pasti ada kekurangan kelebihan nya ekspor cepet kekurangan nya format yg sedikit","yang,sudah,cepat,cuma,kurang,saja,yang,size,gede,wajar,wajar,saja,turut,saya,kurang,sempurna,karena,ada,lebih,pasti,ada,kurang,lebih,cepat,kurang,yang,sedikit",-15,negative
438,alfia khusna,1,2023-09-16T14:51:34.000,"Kenapa ga bisa klik search ya? Kirain tadinya karena hpku lemot. Ini udah ganti hp juga tetep gabisa search. Sayang banget padahal aplikasinya bagus, template lengkap. Tp bingung juga gabisa search.","tidak,kira,karena,lot,sudah,ganti,sayang,aplikasi,bagus,lengkap",-2,negative
439,Yusnita Iteh,1,2023-09-09T21:03:55.000,"Aplikasi nya bagus,tapi pas saya sudh selesai me edit tugas sekolah saya mau instal editan itu tapi ada tulisan pro itu lalu saya tukar afek nya menjadi tidak pro eh malah ada katanya efek pro ""ganguan:berdasarkan kata"" Emng nya ada efek itu,kalo ada Dimana letak nyaa tolooong di balas yaa defloper saya mau ngerjain tugas","aplikasi,pas,saya,sudah,selesai,tugas,sekolah,saya,mau,pasang,itu,ada,itu,lalu,saya,tukar,jadi,tidak,ada,kata,efek,kata,memang,ada,efek,ada,balas,saya,mau,tugas",28,positive
440,Rizki Ananda,1,2023-10-12T12:07:28.000,Sudah diupdate dan penyimpanan masih banyak tapi aplikasi sering force close dan crash parah ga bisa dipakai. Mohon pembenahannya.,"sudah,terbaru,simpan,banyak,aplikasi,sering,paksa,tutup,rusak,parah,tidak,mohon",-5,negative
441,Sahira,2,2023-09-21T14:05:36.000,"app ini udh gasebagus dlu , setiap sy ingin membuat video dngn tamplate dn mngekspor nya , psti video nya tdk ada di galeri , dlu tidak bgitu sblm nya dan juga pas mau di liat video nya layarnya hitam dn tdk ad suaranya.","saya,buat,pasti,tidak,ada,tidak,pas,mau,lihat,hitam,tidak,ada,suara",3,positive
442,Bunga Putri,3,2023-10-13T12:16:40.000,"Aplikasinya bagus,, tpi update nya terlalu sering dan MB nya lumayan besar juga.. klo gk di-update aplikasi tidak bisa dipakai.. jadi klo bisa kurangi update nya.. dan tolong perbaiki lagi.🙏","aplikasi,bagus,terbaru,terlalu,sering,lumayan,besar,kalau,tidak,terbaru,aplikasi,tidak,jadi,kalau,kurang,terbaru,tolong,baik,lagi",-5,negative
443,Jose Yuan Chandra Nugraha,4,2023-09-06T11:13:23.000,"Salah satu efek/animasi untuk kata² tidak memiliki tulisan PRO tetapi saat saya ingin ekspor malah disuruh menggunakan versi PRO karena efek tersebut khusus untuk versi PRO, nama efek/animasi nya: Glitch","salah,satu,kata,tidak,milik,saya,suruh,guna,karena,efek",-10,negative
444,slamet,5,2023-10-16T06:39:22.000,"Sangat membantu untuk pengeditan video, mohon usul supaya dilengkapi fitur-fitur untuk mengedit suaranya, dan efek yang menarik, terimakasih CapCut-Editor","sangat,bantu,mohon,usul,supaya,lengkap,suara,efek,yang,tarik,terima kasih",16,positive
445,Aurell Dunant Rangkuty,2,2023-10-31T09:19:04.000,"Versi 7.9.0 bermasalah, saat dibuat titik beat, titik beat tidak muncul, ketika titik beat dihapus juga tidak terhapus, harus keluar aplikasi dulu baru terlihat kembali","masalah,buat,titik,titik,tidak,muncul,titik,hapus,tidak,hapus,harus,keluar,aplikasi,lihat",-36,negative
446,khrnn_ ma,3,2023-09-10T21:37:25.000,"makin lama makin gak betul deh capcut ni, masak iya aku edit video dan di galery itu ada suaranya eh pas di edit di capcut malah hilang total suaranya plis deh udah di edit sampe akhir berharap bagus malah suaranya ngilang😭😭😭nangis banget ngerjain tugas begini","makin,lama,makin,betul,masak,aku,itu,ada,suara,pas,hilang,suara,tolong,sudah,sampai,harap,bagus,suara,hilang,nang,tugas,begini",24,positive
447,Aldy Sepriawan Listanto,2,2023-10-08T01:11:21.000,"Fitur searchnya ngebug, selalu ada tulisan ""tidak dapat dimuat, ketuk untuk coba lagi"". Sebelum dan setelah update sama aja masih ngebug","ada,tidak,dapat,coba,lagi,terbaru,sama,saja",4,positive
448,davidzaki El26,2,2023-09-08T16:52:57.000,"Setelah update kok fitur pencarian template gak bisa di pake ya?? Malah ada tulisan ""tidak dapat dimuat, ketuk untuk mencoba lagi"" , Udh update yang kedua kalinya juga masih tetep sama aja. Tolong dong solusinya","terbaru,cari,ada,tidak,dapat,coba,lagi,terbaru,yang,dua,sama,saja,tolong,solusi",2,positive
449,Fitriatin Hasanah,1,2023-10-30T04:31:48.000,"Capcut tidak seperti dulu, versi sekarang setiap edit vidio sendiri ketika mau di save selalu kembali ke awal tidak bisa di save. Mohon diperbaiki kembali. Terimakasih","tidak,seperti,sendiri,mau,awal,tidak,mohon,baik,terima kasih",3,positive
450,Fitriani Salote,4,2023-10-09T23:50:00.000,"Saya kasih bintang 4. apk nya bgus, sudh lama juga saya pakai ini. tapi kali ini tiap gunakan template, fotonya buram/pecah. gak kaya sebelum²nya. pdhal udh di update, gada msalah jringn juga","saya,kasih,aplikasi,bagus,sudah,lama,saya,guna,foto,kaya,terbaru",3,positive
451,Diki Maulana,4,2023-11-02T04:25:17.000,Aplikasi nya bagus banget karena bisa bikin video video keren pokok nya the best deh buat capcut😁💐 tapi mohon untuk pengguna capcut pp nya jangan aneh2 bisa di lihat oleh ank kecil jadi jangan pake pp aneh ya😊 segitu aja ulasan dari saya terima kasih,"aplikasi,bagus,karena,pokok,terbaik,buat,mohon,guna,jangan,aneh,lihat,kecil,jadi,jangan,aneh,segitu,saja,dari,saya,terima,kasih",2,positive
452,Gentzyy,5,2023-10-22T20:11:00.000,"APLIKASI EDITING VIDEO YG SANGAT COCOK BAGI; CONTENT CREATOR,GAMING EDITING,VLOG TIKTOK-INSTAGRAM,DAN YG LEBIH UTAMA BAGI YG GAK SUKA RIBET EDIT BISA LANGSUNG KE TEMPLAT YG SUDAH DISEDIAKAN!.. tapi saya bermaksud menyampaikan salah satu kekurangan dan keluhan saya dalam editing video seperti; TEMPLATE YG BOROS KUOTA dan OPSI HD YG BELUM TERLALU MAKSIMAL. Itu saja umpan balik dari saya :)","aplikasi,yang,sangat,cocok,bagi,yang,lebih,bagi,yang,suka,ribet,langsung,yang,sudah,sedia,saya,maksud,sampai,salah,satu,kurang,saya,dalam,seperti,yang,boros,kuota,yang,terlalu,maksimal,itu,saja,umpan,balik,dari,saya",-42,negative
453,rizqi fiisma,2,2023-09-29T05:40:08.000,"Sudah instal dan uninstall betkali kali kenapa ketika buka template media ndak terlihat gambarnya ya, baik foto atau vidio. Diperbesar gambar juga tidak terlihat, jd lebih susah mau memilih gmbar mana","sudah,pasang,copot,buka,tidak,lihat,gambar,baik,foto,besar,gambar,tidak,lihat,jadi,lebih,susah,mau,pilih",23,positive
454,Paluvi merry Mahardani,3,2023-10-20T13:03:47.000,Seru sih tapi menurut aku kalau mau masuk tolong jangan error dan langsung keluar dari aplikasi nya tolong jangan error terus dan ada iklannya itu aja sekian dan terimakasih🙏,"seru,turut,aku,kalau,mau,tolong,jangan,error,langsung,keluar,dari,aplikasi,tolong,jangan,error,ada,itu,saja,terima kasih",-15,negative
455,Marisa Wandiana,1,2023-10-20T09:46:44.000,"Saya update malah bagian pencarian tidak dapat memuat padahal dibagian for you dll bisa keluar templat nya padahal wifi saya jaringannya juga bagus,tolong DI PERBAIKI!","saya,terbaru,bagi,cari,tidak,dapat,bagi,keluar,saya,jaringan,baik",-1,negative
456,Dede Aik,4,2023-09-27T04:38:10.000,"Saya suka banget dengan capcut,bisa mengedit video dengan hasil bagus,tapi kenapa sekarang saya tidak bisa masuk ke akun saya dan tidak menemukan menu.bisa masuk cap cut tapi tidak bisa masuk ke profil dan tidak bisa menemukan menu ,makanya aku kasih bintang 4 dulu,heran saya udah aku hapus cache,hapus data, uninstall terus install ulang berkali kali tapi kenapa saya tetep tidak bisa masuk.tolong admin bantu saya dong biar bisa masuk lagi","saya,suka,hasil,saya,tidak,saya,tidak,temu,tidak,tidak,temu,aku,kasih,saya,sudah,aku,hapus,data,copot,pasang,saya,tidak,bantu,saya,lagi",-25,negative
457,Indri Nur novianti,3,2023-10-19T19:31:55.000,"Bagus sih bagus, minimal jangan ngelag² lah, masa gua mau save vidio ga bisa bisa, pdhal memo gua ga penuh, data aman nyala, trus ga bisa nambahin vidio, eror abis capcut, saya kritik seperti ini agar di benahi dan tidak untuk terjadi lagi. TRIMAKASIH MOHON JANGAN EROR MULU CAPCUT.","bagus,bagus,minimal,jangan,saya,mau,tidak,saya,tidak,data,nyala,tidak,error,habis,saya,kritik,seperti,agar,tidak,jadi,lagi,terima kasih,mohon,jangan,error,melulu",-44,negative
458,CHATERINE Florensia,5,2023-09-26T14:58:53.000,Capcut sangat membantu saya untuk mengedit video. Misalnya hati tu tugas sklh ngedit video sebagus mungkin untuk ada capcut yg membantu saya jdi tugas saya selesai dengan bagus. ☺☺ trimakasih capcut untuk bantuan ny ☺☺,"sangat,bantu,saya,hati,tugas,sekolah,bagus,mungkin,ada,yang,bantu,saya,jadi,tugas,saya,selesai,bagus,terima kasih,bantu",16,positive
459,Arif solfiah Arif solfiah,4,2023-09-24T20:14:13.000,Hi Developer selama ini sebenarnya Capcut itu udah bagus hanya aja ada satu yaitu waktu mau gunain salh satu template itu fotonya sama kayak foto aslinya padahal udah login akun.Mohon diperbaiki yaa semisal masalahnya ada di apk nya maaf kalo ada kesalahan🙏semangat,"hai,lama,benar,itu,sudah,bagus,hanya,saja,ada,satu,mau,satu,itu,foto,sama,kayak,foto,asli,sudah,baik,masalah,ada,aplikasi,maaf,kalau,ada,salah,semangat",26,positive
460,Annisa Sari,2,2023-09-27T18:58:21.000,"ini buat yang pake android walaupun hpnya masih baru, apalagi yang punya darah tinggi, sabar sabarin aja dah, bikin emosi banget ni aplikasi nge lagnya gak ngotak, kadang efeknya muncul kadang nggk, hadeh, mana udh capek² ngedit pas di ekspor malah ga sesuai ekspetasi, slowmotionnya juga udh dihalusin pas di ekspor malah patah² ckckck","buat,yang,yang,punya,darah,tinggi,sabar,sabar,saja,sudah,emosi,aplikasi,otak,kadang,efek,muncul,kadang,tidak,hadeh,capek,pas,tidak,sesuai,pas,patah",18,positive
461,Ayoe Zhulia,2,2023-10-22T20:18:28.000,"Aplikasi bagus,tp sayang, lemottt, loading lama, sering keluar sendiri, bikin hp ngunci sendiri, gak jelas bikin satu video butuh kesabaran & waktu, bagusin lg lah sayang udh bagus!","aplikasi,sayang,lama,sering,keluar,sendiri,sendiri,jelas,satu,butuh,sabar,lagi,sayang,bagus",-5,negative
462,Vina Trisianasari,2,2023-10-09T13:35:27.000,"Kenapa di saya eror ya, tidak bisa di pakai , harus di uninstal dulu trus instal lagi baru bisa di pakai dan itupun cuma bisa kepakek sekali, kalo mau pakai harus uninstal dulu trus instal lagi ,, tolong di perbaiki ya kak,, aplikasinya bagus sebenarnya, cuma ya itu, di saya eror , bintang 2 dulu nanti klo sudah normal di ubah","saya,error,tidak,harus,copot,pasang,lagi,itu,cuma,sekali,kalau,mau,harus,copot,pasang,lagi,tolong,baik,aplikasi,bagus,benar,cuma,itu,saya,error,nanti,kalau,sudah,normal",-32,negative
463,Vircia nafwa Aryadana,3,2023-10-31T13:28:02.000,"pas video nya ditautkan ke tiktok, ehh akun tiktok sy malah hilang gara' capcut ini. trs juga sekarang logo nya ga bisa dihilangkan pdhl sudah ditautkan ke tiktok agar logonya hilang. tolong diperbaiki lagi sprti capcut yg lama, yg logonya bisa hilang 😥","pas,taut,saya,hilang,gara,tidak,hilang,sudah,taut,agar,hilang,tolong,baik,lagi,seperti,yang,lama,yang,hilang",-10,negative
464,Redmi Silver,4,2023-09-21T19:32:16.000,Ini sih udah bagus tapi sedikit bug kayak. Apa gitu ketika saya baru download tu capcut tiba tiba hp saya mati gak tau masalah nya apa padahal baterai nya masih 67%persen padahal dan saya tolong perbaiki ya 💌,"sudah,bagus,sedikit,kayak,apa,saya,saya,mati,tahu,masalah,apa,baterai,persen,saya,tolong,baik",-13,negative
465,wahdini Arhan23,4,2023-10-30T20:24:02.000,Sebenernya binggung kenapa video abis pake template enggak bisa di download.. katanya ada masalah coba lagi..Uda di coba 5x tetap enggak mau ke simpan.. di wa sama Ig juga begitu ini ..ini hp ku yg ada masalah atau ngimana ya😔🥲,"sebenarnya,habis,tidak,kata,ada,masalah,coba,coba,tetap,tidak,mau,simpan,sama,yang,ada,masalah",3,positive
466,St ratnadini,2,2023-09-23T20:29:39.000,"Capcut setelah di update jadi jelek, masa waktu ngedit template pas udah pilih foto mau ganti yang lain kembali ke awal harus gulir gulir jauh lagi buat nyari foto nya.","terbaru,jadi,jelek,pas,sudah,pilih,foto,mau,ganti,yang,lain,awal,harus,gulir,gulir,jauh,lagi,buat,mencari,foto",-9,negative
467,Ebta Nas,4,2023-10-31T22:40:23.000,"tolong di perbaiki lagii capcutt,mau ekspor vidio udah full sampai detik terakhir,tapi pas kedownload gak sampai detik terakhir vidionya menjadi hitam,tidak ada fotonya,uda berkali kali kayak giniii, tolongg diperbaiki","tolong,baik,lagi,sudah,sampai,pas,sampai,jadi,ada,kayak,baik",13,positive
468,Savior Yuri,1,2023-10-25T22:01:13.000,"Setelah update semakin jelek , ribett klo ngedit pake template , setiap mo ganti foto/video harus ulang dri awal lagi.. gk sukaa capcut yg skrang , aneh!!!!!!!!!","terbaru,makin,jelek,kalau,mau,ganti,harus,dari,awal,lagi,tidak,suka,yang,aneh",-4,negative
469,Syam Sudin,5,2023-09-13T11:14:11.000,Terimakasih CapCut telah perkenalkan pada kami pengalaman yang luarbiasa. Dan semua sangat membantu memudahkan kami untuk menjadi kreator yang kreatif. Dengan CapCut Saya bisa menghibur punya banyak teman yang baik. CapCut you are the best. Terimakasih CapCut,"terima kasih,kenal,pada,alam,yang,semua,sangat,bantu,mudah,jadi,yang,kreatif,saya,punya,banyak,yang,baik,terbaik,terima kasih",20,positive
470,Syafinatun Naza,1,2023-11-02T15:10:49.000,"Kenapa yaa aya ada tandai airan lagii walaupun yang di klik yang langsung berhubungan ke tiktok, dan kenapa banyak sekali vidio yang tidak ada suara, dan capcut stelah di update makin kurng baguss, tolong di perbaiki ya minnnn","aya,ada,tanda,air,lagi,yang,yang,langsung,hubung,banyak,sekali,yang,tidak,ada,suara,terbaru,makin,kurang,bagus,tolong,baik",-1,negative
471,tita alysia,5,2023-10-15T16:52:27.000,"tolong ini bagaimana ya? saya sudah memakai capcut dr 2020, baru kali ini apk capcutnya tidak bisa di buka sama sekali dgn alasan ""aplikasi telah berhenti"". Saya mau kirim masukan pun tidak bisa, tolong respon dr pihak capcutnya.","tolong,saya,sudah,dari,aplikasi,tidak,buka,sama,sekali,aplikasi,henti,saya,mau,kirim,pun,tidak,tolong,respon,dari,pihak",-27,negative
472,Depi Kurniawati,5,2023-11-02T10:40:08.000,"Aplikasi nya sangat bagus, banyak fitur fitur dan efek yang bagus untuk pengeditan video, jadi sangat membantu jika ingin mengedit video","aplikasi,sangat,bagus,banyak,efek,yang,bagus,jadi,sangat,bantu",11,positive
473,Fahri Maulana,1,2023-09-29T22:41:38.000,"Saya memberikan bintang satu di karenakan banyak bug bug pada aplikasi juga aplikasi semakin berat sehingga menjadi lemot,dan juga lebih mengoptimalkan waktu menggunakan template","saya,beri,satu,karena,banyak,pada,aplikasi,aplikasi,makin,jadi,lebih,guna",-4,negative
474,Jilian Samsung,3,2023-10-31T19:26:39.000,"Sebenernya apk ini sangat bagus untuk mengedit,tetapi mengapa ya kalau saya ingin ekspor video nya,dan pas selesai malah tidak ada di galeri? Apakah cuma saya yang seperti ini?? mohon maaf kalau ada kesalah ucapan.","sebenarnya,aplikasi,sangat,bagus,kalau,saya,pas,selesai,tidak,ada,cuma,saya,yang,seperti,mohon,maaf,kalau,ada,salah,ucap",-6,negative
475,Hah hah,3,2023-11-02T00:08:02.000,"Saat saya mengedit.awal awalnya tidak ada yang aneh,dan suara yang saya pakai itu 15 detik,tapi ketika hampir selesai dan saya dengarkan ulang malah suaranya selesai di detik ke 10","saya,awal,tidak,ada,yang,suara,yang,saya,itu,selesai,saya,dengar,suara,selesai",-10,negative
476,Khusnan Fadilah,3,2023-09-28T01:31:12.000,"sebelumnya maaf min, aplikasinya bagus. tp saya mengalami kendala. kok overlay,nya tidakbisa diganti ya? padahal sudah saya centang. mohon diperbaiki. nanti bintangnya saya tambah. terimakasih 🙏","maaf,aplikasi,bagus,saya,alami,ganti,sudah,saya,centang,mohon,baik,nanti,saya,tambah,terima kasih",0,neutral
477,Yadi Jayadi,1,2023-09-11T19:07:56.000,Saya tidak bisa upload padahal memori saya masih banyak dan tidak bisa search dan tulisan nya coba lagi dalam beberapa waktu padahal jaringan saya dan wifi saya stabil saja ini aplikasi yang sangat buruk yang saya pernah pakai,"saya,tidak,saya,banyak,tidak,coba,lagi,dalam,jaringan,saya,saya,stabil,saja,aplikasi,yang,sangat,buruk,yang,saya",-33,negative
478,Nde Mrg,1,2023-09-21T23:33:50.000,"Makin hari makin eror ni capcut,jaringan baik hp udh banyak penyimpanannya kok malah gak bisa gerak malah² mati sendiri hp gw saat mau makai templat nya,tolong di perbaiki lagi ini capcut, lebih baik makai capcut yang lama...,,..","makin,makin,error,baik,banyak,simpan,mati,sendiri,saya,mau,baik,lagi,lebih,baik,yang,lama",0,neutral
479,andi adikarta,5,2023-09-28T21:17:56.000,"Sudah bagus, Cuma sering terjadi pas mau save tidak bisa dan tulisannya internet lost connect , padahal wifi on...! Dan bagaimana cara gabung ke pro min?","sudah,bagus,cuma,sering,jadi,pas,mau,tidak,hilang,sambung,gabung",4,positive
480,Ipul Tegal,1,2023-10-29T14:30:47.000,"Tolong di edit lagi ,saya mengekspor video yang ada di cap cut malah ada tanda air nya padahal sudah di tekan tiktok yang tidak ada tanda air eh malah ada gimana sih tolong dong di edit lagi","tolong,lagi,saya,yang,ada,ada,tanda,air,sudah,tekan,yang,tidak,ada,tanda,air,ada,tolong,lagi",-14,negative
481,Nindita Putri,3,2023-10-22T15:44:21.000,"kenapa si capcut sekarang lemot? padahal signal nya aja di pake buat yang lain lancar"" aja pas di pake buat cari template malah lemot terus juga pas mau pencet proyek template nya malah item doang","lot,saja,buat,yang,lain,lancar,saja,pas,buat,cari,lot,pas,mau,pencet,hitam,doang",-16,negative
482,Radiska Ahza,2,2023-09-19T05:37:35.000,"Bugnya ganggu bgt, aku mau ngedit jadi ga sesuai, padahal memorinya masih banyak, kalo udah pake banyak efek, kunci dll pasti langsung ngelag","ganggu,aku,mau,jadi,tidak,sesuai,banyak,kalau,sudah,banyak,efek,kunci,pasti,langsung",22,positive
483,Alma Siti,5,2023-10-10T17:07:43.000,Menurut ku ini appk nya cukup baik dan seru klo mau bikin efit buatan kita bisa tamplet kata kta yang aestetic dan saran ku sudah tidak perlu di update soalnya udh lancar dan bisa menjelaskan foto/vidieo yang kita buat terima kasihh... 💗💞,"turut,cukup,baik,seru,kalau,mau,buat,kata,yang,saran,sudah,tidak,perlu,terbaru,soal,lancar,jelas,yang,buat,terima,kasih",9,positive
484,Akila Aisah,5,2023-09-12T21:43:44.000,"Bagus,mudah digunakan dan seru! Jarang ada iklan dan kalau gak ada kota atau yang wifi tapi mati lampu itu yang udah disimpan bisa diliat .itu aja dari aku>>>333 makasih","guna,seru,ada,kalau,ada,kota,yang,mati,lampu,itu,yang,sudah,simpan,lihat,itu,saja,dari,aku,terima kasih",10,positive
485,Nadia,1,2023-09-05T21:50:41.000,"gatau kenapa setiap mau nge ekspor hasil nya selalu hitam padahal udah di tambahin foto, udah donwload hapus donwload hapus beberapa kali masih ttp kaya gitu, penyimpanan juga masih banyak, tlng perbaiki karena itu sngt mengganggu saya dalm mengedit","gatau,mau,hasil,hitam,sudah,tambah,foto,sudah,hapus,hapus,kaya,simpan,banyak,tolong,baik,karena,itu,sangat,ganggu,saya",3,positive
486,Donquixote_ Sudiro,1,2023-10-19T12:06:02.000,"Dulu Capcut walau sederhana tapi enak buat edit video, hari ini lagi edit video tiba tiba lag dan gak mau jalan harus bolak balik keluar dulu biar bisa lanjut, mbok ya segera di perbaiki, saya pake capcut dari apk ini sudah lama banget tapi baru kali ini merasakan hal seperti ini,, mohon maaf banget harus ngomong seperti ini,, karena dulu capcut tuh pilihan terbaik buat edit video saya sangat mencintai capcut","walau,sederhana,enak,buat,lagi,mau,harus,balik,keluar,lanjut,segera,baik,saya,dari,aplikasi,sudah,lama,rasa,seperti,mohon,maaf,harus,seperti,karena,pilih,baik,buat,saya,sangat,cinta",-9,negative
487,Linda Saumi (Linda),4,2023-10-30T20:13:22.000,"Animasi, efek, filter, dsb banyak fitur menarik, namun bug, lag, lemot saat mengedit yang berat seperti video sekolah, tapi okelah","efek,banyak,tarik,lot,yang,seperti,sekolah,oke",2,positive
488,Dw• Prayoga,1,2023-10-25T17:54:41.000,apk ny semakin di update semakin down.. masa iya pas ngedit patah patah terus langsung keluar... Mana template nya g kesimpen lagi malah ulang nyari template ny susah bngt ngedit setelah di update... Tolong ini perbaiki lagi,"aplikasi,makin,terbaru,makin,pas,patah,patah,langsung,keluar,lagi,mencari,susah,terbaru,tolong,baik,lagi",-8,negative
489,Zafina 633,4,2023-09-12T22:38:06.000,"Capcut ini bagus bgtt, cuma yang kurang nya itu pas mengekspor vidio, itu lag bgt, apalagi kalau kita kebanyakan overlay,lag bgt itu, jadi nya aku gk bisa mengedit vidio lebih banyak","bagus,cuma,yang,kurang,itu,pas,itu,kalau,banyak,itu,jadi,aku,tidak,lebih,banyak",-8,negative
490,Salman Alfarisi,3,2023-09-22T21:34:29.000,"Saya sebagai kreator pembuatan animasi, menyarankan agar capcut menambahkan fitur untuk menarik objek yang bisa di gunakan pada bingkai utama dan overlay","saya,buat,saran,agar,tambah,tarik,yang,guna,pada",-5,negative
491,Dzepro?,4,2023-10-21T18:12:22.000,"Mantap ! Cuma saya butuh banget nih tolong masukin ke capcut, efek² baru sama nge group in media. dari media yang banyak dijadiin satu perintah jadi gerakannya sama semua satu grup. Inimah tolong banget sih","mantap,cuma,saya,butuh,tolong,efek,sama,dari,yang,banyak,satu,jadi,sama,semua,satu,grup,tolong",-6,negative
492,Arifin Bae,2,2023-10-31T23:07:44.000,"Banyak bug, terutama saat mengEkspor video sering mentok di 99℅, tolong perbaiki secepatnya demi kenyamanan pengguna!","banyak,sering,mentok,tolong,baik,cepat,nyaman,guna",10,positive
493,Ahyani Siswo,3,2023-10-06T11:57:21.000,Aplikasi nya sih bagus banget tapi pas aku mau nonton fidio itu kebanyakan muter2 terus. Terus pas aku mau ngedit memuatnya tu lama jadi pas pakek ini tu habisin pulsa tapi menurut ku bagus kok aku kasih reting 3,"aplikasi,bagus,pas,aku,mau,itu,banyak,pas,aku,mau,lama,jadi,pas,pulsa,turut,bagus,aku,kasih",19,positive
494,Aqila Inass Tsuroya,4,2023-10-30T16:48:35.000,"Sebenar nya sih bgus bgt ya,tp klo di update menginstal nyaa setengah jam,trs sring ngelag,memori jd penuhh, kdg bisa tiba"" ke luar sndiri, berhenti sndiri,klo ngeekspor lama pke bngt smpe ketiduran😅","benar,bagus,kalau,terbaru,tengah,jadi,sendiri,henti,lama,tidur",2,positive
495,Ocha Auliviq,1,2023-09-08T18:20:36.000,"Makin update makin ngelag , Vidio yang diekspor patah² terus nge lag , padahal tadinya ngg ,,, BTW INI YAHHHH!!! KOK GAK BISAA MASUK KETEMPLAT NYA , LOADING DARI TDI MASEHHH 0 MULU ANJ, padahal wifi/data lancar gimana sih toll","makin,terbaru,makin,yang,patah,dari,melulu,anjing,lancar",-7,negative
496,reny rahayu,1,2023-10-20T16:39:46.000,Kenapa ya kan waktu itu sya mau Download cap cut tp malah ga bisa.. Malah muncul tulisan.. Tidak bisa mendownload silakan cari cara umum untuk memperbaiki..trz sya cara di youtube buat memperbaiki ttep ga bisa..,"itu,mau,tidak,muncul,tidak,sila,cari,umum,buat,baik,tidak",-8,negative
