,userName,score,at,content,clean_teks,polarity_score,polarity
648,BLACK WHITE,4,2023-06-26T17:28:46.000,"(indonesia) Untuk fitur aplikasi capcut ini saya sudah puas, tetapi sayangnya fitur efek dan animasi offline sudah tidak ada, ini membuat pengguna sulit melakukan edit video saat tidak ada koneksi internet, semoga untuk update kedepan lebih baik. (english) I am satisfied with the capcut application feature, but unfortunately the offline effects and animation features are gone, this makes it difficult for users to edit videos when there is no internet connection.","aplikasi,saya,sudah,puas,sayang,efek,sudah,tidak,ada,buat,guna,tidak,ada,koneksi,moga,terbaru,lebih,baik,mungkin,gone",16,positive
649,Ziffara Alkayyisa,5,2023-09-15T21:20:18.000,Apk bagus. Tetapi mungkin pas pertama kali mnggunakan apk ini ada iklan nya lumayan banyak tapi itu tidak mengganggu saya. Mungkin iklan nya di hapus saja ya makasih.,"aplikasi,bagus,mungkin,pas,aplikasi,ada,lumayan,banyak,itu,tidak,ganggu,saya,mungkin,hapus,saja,terima kasih",-12,negative
650,STARX COFFEE,5,2023-09-15T21:41:07.000,Mantap luar biasa banget memberi banyak pembelajaran dg fitur yang sangat bagus dan mudah digunakan khususnya saya pemula.,"mantap,biasa,beri,banyak,ajar,yang,sangat,bagus,mudah,guna,saya,mula",12,positive
651,Af Fatah,5,2023-10-07T12:37:57.000,Saya senang sekali banyak fitur baru dan efek baru Tapi ada sedikit keluhan pas sayah ngedit ada patah-patah entah ngebak atau gimanah sinyal bagus tolong optimal kal lagi buyar makin rame yang make Amin sekiyan terima kasih,"saya,senang,sekali,banyak,efek,ada,sedikit,pas,ada,entah,bagus,tolong,lagi,makin,ramai,yang,amin,terima,kasih",15,positive
652,Hgrcgc Vghgt,5,2023-11-12T11:47:24.000,Aplikasi capcut emang debes tapi saya tidak bisa upload video saya ya di edit ke akun Capcut tapi pokoknya aplikasi ini debes dan tiktok saya dan YouTube saya gara-gara banyak like gara-gara edit di sini makasih Capcut emang debes 👍👍👍👍👍,"aplikasi,saya,tidak,saya,pokok,aplikasi,saya,saya,banyak,terima kasih",-14,negative
653,Cristilia Dalu,4,2023-10-15T13:19:38.000,"ini aplikasi bagus banget sihh,,tapi biasanya banyak iklannya,,iklannya pun aneh aneh. Tapi template bagus kok🤩","aplikasi,bagus,biasa,banyak,pun,aneh,aneh,bagus",10,positive
654,Kinar Kinar,3,2023-08-12T23:28:41.000,"Aplikasi capcut memang bagus, tapi sayang nya kenapa ya, saat saya mengedit video saya, tiba-tiba tidak bisa disimpan begitu pun, gak itu saja, perbaduan suara pun tidak bisa disatuin dengan, video saya, soalnya suka keluar sendiri mulu, tolong diperbaiki ya dengan baik.. semogadengan baik lagi ya seperti dulu..🙏","aplikasi,memang,bagus,sayang,saya,saya,tidak,simpan,pun,itu,saja,suara,pun,tidak,saya,soal,suka,keluar,sendiri,melulu,tolong,baik,baik,baik,lagi,seperti",-30,negative
655,Salma Aditya,5,2023-10-19T12:20:26.000,Aplikasinya membantu banget buat edit2 vidio. Lebih suka lagi sama tamplate nya bagus2 jadi ngedit vidio lebih mudah cepat tapi hasilnya bagus,"aplikasi,bantu,buat,lebih,suka,lagi,sama,bagus,jadi,lebih,mudah,cepat,hasil,bagus",20,positive
656,Ryandhi Irawan,1,2023-11-29T23:27:51.000,Tolong dong mohon diperhatikan dan diperbaiki lagi... Soal buat nge ekspor tidak bisa selalu gagal mohon diperbaiki segera....,"tolong,mohon,baik,lagi,soal,buat,tidak,gagal,mohon,baik,segera",-1,negative
657,Ilma shez,4,2023-10-06T14:54:56.000,"Aplikasinya bagus banget,tapi kadang-kadang waktu iklan gak ada tombol ""x"" nya,mohon diperbaiki ya.","aplikasi,bagus,ada,baik",5,positive
658,Arie Tok,1,2023-11-21T13:13:59.000,"Sepertinya mereka hanya bisa membuat tapi tidak bisa mengelola, terlalu banyak bug dan eror, sebenernya bagus tapi apa guna kalo eror","seperti,hanya,buat,tidak,terlalu,banyak,error,sebenarnya,bagus,apa,guna,kalau,error",-15,negative
659,Sabrina Deswita,5,2023-10-21T16:17:25.000,bagus banget aplikasinya jadi suka dehh pake ini setiap hari buat bikin jeje bagus banget tapi biasanya suka ada bug tapi gapapa yang penting bisa bikin jeje terus sekarang bagus bagus jeje nya jadi Makij suka lopyu banget yang ciptain ini aplikasi suka banget soalnya kalo gaada ini harus pake aplikasi yang lain terus capcut langsung ada template jadi bagi yang gabisa ngedit bisa pke capcut soalnya ada juga apa itu lah pokonya baii lopyu🤩🤩🙏💗,"bagus,aplikasi,jadi,suka,buat,bagus,biasa,suka,ada,yang,penting,bagus,bagus,jadi,suka,yang,aplikasi,suka,soal,kalau,harus,aplikasi,yang,lain,langsung,ada,jadi,bagi,yang,soal,ada,apa,itu,poko",-5,negative
660,eyang gendhon,5,2023-10-21T19:54:18.000,Bagus banget n mudah sekali cara membuat postingannya...semoga bagus terus... Kok setelah tak reset hp ku ...capcut malah gak bisa mengedit....help me,"bagus,mudah,sekali,buat,bagus,tidak",3,positive
661,VALENTA 26,4,2023-10-04T14:37:37.000,Untuk capcut preface lah ya tapi buram gerak nya di bagus kan untuk template yang lain sangat susah untuk menyesuaikan buram gerak nya,"buram,bagus,yang,lain,sangat,susah,sesuai,buram",-10,negative
662,Arief Agustian,5,2023-10-13T01:32:58.000,Keren banget... Cuma susah untuk pemula yg baru mulai belajar nulis.. buat ngeditnya susah dan ribet.. Hehehe,"cuma,susah,mula,yang,mulai,ajar,buat,susah,ribet,ketawa",-14,negative
663,Didik Saputra,1,2023-10-15T07:50:00.000,Cap cut nya lelet kayak eror gitu pas dipencet capcut nya malah eror keluar lagi tolong diperbaiki lagi ya cap cut nya kalok sudah diperbaiki capcut nya akan aku kasih bintang 5 tapi untuk saat ini saya kasih bintang 1 soal nya lelet eror,"lambat,kayak,error,pas,pencet,error,keluar,lagi,tolong,baik,lagi,kalau,sudah,baik,aku,kasih,saya,kasih,soal,lambat,error",-16,negative
664,Wakijo Wakijo,5,2023-09-28T11:23:52.000,"Untuk berispirasi giat di lapangan di waktu kerja & buat mengenal semua sifat yg di nilai untuk di butuhkan sering buat melihat sesuatu mungkin membuat berguna buat orang2 yg mungkin ingin mengenalkan bagi orang banyak,","lapang,buat,kenal,semua,yang,nilai,butuh,sering,buat,lihat,mungkin,buat,guna,buat,yang,mungkin,kenal,bagi,banyak",10,positive
665,CHARISSTA LARASATI,2,2023-09-28T12:40:06.000,Ini saya tadi coba tapi agak lemot jadi bukan foto kita tapi fotonya yang di buat itu nya aku paling nyesel soalnya kayak gitu. Mohon untuk di perbaiki lagi trimakasih,"saya,coba,lot,jadi,bukan,foto,foto,yang,buat,itu,aku,sesal,soal,kayak,mohon,baik,lagi,terima kasih",-2,negative
666,Sofia Ty,1,2023-11-13T04:04:54.000,"ini knp abis di update malah gk bisa di loginin pake akun google!!?, mana fitur template gak ada lagi, ini cuma di eror di hp gw doang apa gmna sih, mohon dong kepada developernya segera diperbaiki","habis,terbaru,tidak,ada,lagi,cuma,error,saya,doang,apa,mohon,segera,baik",-2,negative
667,Siapa Saja,1,2023-09-19T23:19:02.000,"Maaf ini knp semakin lama semakin besar ukuran nya ya mohon di buat sepertu dulu agar pengguna hp""kentang/kecil bisa merasakan juga saya mohon untuk pihak capcut ukuran nya di perkecil sedikit mohon kerjasama nya🙏","maaf,makin,lama,makin,besar,ukur,mohon,buat,agar,guna,rasa,saya,mohon,pihak,ukur,kecil,sedikit,mohon,kerjasama",5,positive
668,amel putri,2,2023-11-24T20:14:16.000,"Aplikasi ny emng bagus,cuma kalo aku mah search kaya mau nyari2 template itu ga bisa sama sekali,kecewa banget sama CC yang sekarang","aplikasi,memang,kalau,aku,kaya,mau,mencari,itu,tidak,sama,sama,yang",-1,negative
669,Elvira Citra,3,2023-10-29T13:41:57.000,kenapa ya sekarang semenjak diupdate tetap ada logo capcutnya walaupun sudah diekspor ke tiktok? tolong diperbaiki ya karna kami merasa kurang nyaman ketika ada logonya,"terbaru,tetap,ada,sudah,tolong,baik,karena,rasa,kurang,nyaman,ada",15,positive
670,Fauzan ardi,1,2023-10-13T16:37:40.000,"Kenapa apk capcut nya tidak bisa di buka dan saat mendownload pun ber ulang kali dan ketika di buka apk nya muncul tulisan ""capcut telah berhenti"" kenapa ya?","aplikasi,tidak,buka,pun,buka,aplikasi,muncul,henti",-13,negative
671,Muhammad Husnul,1,2023-09-24T10:35:35.000,"apaan coba perasaan kemaren bagus"" aja nih aplikasi.Tapi tiba"" mau cari template malah gagal memuat terus udah di hapus data, uninstall terus download lagi tetap sama aja kek gitu gajelas sumpah buang"" waktu aja","apa,coba,asa,bagus,saja,mau,cari,gagal,sudah,hapus,data,copot,lagi,tetap,sama,saja,seperti,sumpah,buang,saja",-7,negative
672,Chalista Arkana,4,2023-11-26T21:57:34.000,Aplikasinya lumayan tp sering ngelag+lama loading mohon di perbaiki sy kasih⭐⭐⭐⭐ dlu.. Klo bisa mohon di perbaiki..,"aplikasi,lumayan,sering,mohon,baik,saya,kasih,kalau,mohon,baik",8,positive
673,khalisa adzkia gaming,1,2023-11-17T10:34:49.000,"Terlalu ngehag gak suka ,, hasil ekspor terlambat ,, musik nya gak ngikutin ,, kecewa berat ,, balikin capcut yang dulu.....","terlalu,suka,hasil,lambat,musik,ngikutin,yang",-1,negative
674,Dava.n.s. Sahid,2,2023-11-19T05:58:48.000,Halo ini kok apk nya terus berhenti knp ya masih bisa di install tapi aga tulisan cap cut terus berhenti kenapa ya padahal dulu masih lancar tolong sarannya developer🙏,"halo,aplikasi,henti,pasang,henti,lancar,tolong,saran",-3,negative
675,Neng Faid,1,2023-11-26T15:26:07.000,Di saat saya asik asiknya ngedit vidio tiba tiba lag sendiri dan setelah saya clos trs masuk lagi kadang yang udah saya edit tadi tiba tiba ilang hadeeeeh tolong segera perbIki sekarang setelah di update makin parah waktu buat vidio ngelag anjaaiiiiiii saya ngedit vidio juga tadi malah kepotong trs lagi Tolong segera perbaiki😴,"saya,asik,sendiri,saya,lagi,kadang,yang,sudah,saya,hilang,tolong,segera,terbaru,makin,parah,buat,saya,potong,lagi,tolong,segera,baik",-8,negative
676,Arya Yt,1,2023-09-18T14:51:25.000,"Makin rusak,setiap mau ekspor selalu aja ada kendala seperti force close,macet di pertengahan seperti 50-80%,pas selesai ekspor video nya cuma hitam doang dll","makin,mau,saja,ada,seperti,paksa,tengah,seperti,pas,selesai,cuma,hitam,doang",3,positive
677,Myuan Ganteng,1,2023-11-13T21:30:40.000,Gini amat makin lama makin jelek ni aplikasi Mau loading buat masuk ke template masukin foto 0% terus padahal jaringan lancar di perbaiki dong admin nya gimana sih,"amat,makin,lama,makin,jelek,aplikasi,mau,buat,foto,jaringan,lancar,baik",14,positive
678,Afiqa_fiqa,5,2023-10-22T12:15:50.000,Apk ini bagus banget bisa buat edit vidio yang mau di post di tiktok atau di mana pun trus ada template nya juga trus bagus bagus lg template nya apk ini bisa bantu sya buat konten bagus banget wajib dowload ❤❤❤,"aplikasi,bagus,buat,yang,mau,pun,ada,bagus,bagus,lagi,aplikasi,bantu,buat,bagus,wajib",1,positive
679,Bunga Ulfah,1,2023-09-11T07:43:14.000,Aplikasi nya maaf nih ya Capcut nya apa ada per updetan ini aku pas bikin video malah pas udah expor layar nya hitam itu gimana ya tolong yg buat aplikasi Capcut diperbaiki lagi maaf aku beri rating nya segitu karena saya tidak puas dengan aplikasi Capcut buat temen temen ada yang sama?,"aplikasi,maaf,apa,ada,aku,pas,pas,sudah,hitam,itu,tolong,yang,buat,aplikasi,baik,lagi,maaf,aku,beri,segitu,karena,saya,tidak,puas,aplikasi,buat,ada,yang,sama",-12,negative
680,Nadin Nazania,3,2023-11-26T12:36:30.000,Ini gimana ya mau pake template malah login Mulu tolong ya di perbaikin tolong capcut di perbaiki ya capcut butuh banget ni mau make template 🙏🙏🙏 masyallah login Mulu 🗿 tolong dong capcut aku mau pake template nya login mulu plss di perbaiki ya 🙏 tolong ini jaringan saya nya apa gimana lama amat sumpah ini gimana ya gw mau make template malah keluar dan juga g bisa di pencet loh,"mau,melulu,tolong,tolong,baik,butuh,mau,melulu,tolong,aku,mau,melulu,baik,tolong,jaringan,saya,apa,lama,amat,sumpah,saya,mau,keluar,pencet",-2,negative
681,AVICENAAHMADSENA Sena,1,2023-09-28T15:59:12.000,"Hp saya sering down setelah di pakai untuk mengedit padahal aplikasi ini sangat membantu untuk memudahkan nge dit, kenapa abis nge dit video sering begitu ya ?","saya,sering,aplikasi,sangat,bantu,mudah,habis,sering",12,positive
682,Ekka Lambang,5,2023-09-19T18:41:41.000,"Mohon di optimalkan kembali untuk pengeditanya kak, kadang saat ngedit gak singkron musik sama temanya beatnya juga, tapi kalo udah di simpan lancar","mohon,tanya,kadang,musik,sama,kalau,sudah,simpan,lancar",15,positive
683,Harun Arrasyid,1,2023-10-19T14:18:53.000,Kenapa dengan ini aplikasi kenapa pas saya mencari yang saya inginkan di pencarian malah tidak bisa malahan ada tulisan mohon ketuk untuk mencoba kembali namun pas saya ketuk tidak bisa jadi begitu terus mohon kepada developer tolong kenapa dengan ini aplikasi atau emang dari sayanya yang begitu?,"aplikasi,pas,saya,cari,yang,saya,cari,tidak,ada,mohon,coba,pas,saya,tidak,jadi,mohon,tolong,aplikasi,dari,saya,yang",-34,negative
684,Prasetiyo Adi,2,2023-10-15T01:04:14.000,Saya konten capcut Saya kasih dua bitang... soalnya setiap mau geser musik atau gambar seringkali bug atau aplikasinya eror Tolong aplikasinya di betulkan..🙏🙏,"saya,saya,kasih,dua,soal,mau,geser,musik,gambar,aplikasi,error,tolong,aplikasi,betul",-7,negative
685,Muhammad Rizki Alim mutakin,5,2023-11-24T15:03:12.000,Terbantu sekali sama aplikasi capcut dengan adanya template yang bervariasi jadi mudah untuk edit video,"bantu,sekali,sama,aplikasi,ada,yang,jadi,mudah",5,positive
686,Mac Deodatus,3,2023-11-05T03:35:35.000,"ini sy sudah pakai aplikasi dari lama tapi kenapa akhir akhir ini tidak bisa import audio dari video yaa, tolong responnya bagi developer","saya,sudah,aplikasi,dari,lama,tidak,import,dari,tolong,bagi",-17,negative
687,Padepokan Sunan Sejati,5,2023-07-10T09:40:40.000,Buat yg mengeluh suara lebih cepat dibandingkan gambar .... Tambahan musiknya dimundurkan sedikit saja. (Bukan diperlambat durasi kecepatan).. Jadi saat diekspor galeri / template nanti hasilnya seimbang gambar dan suara,"buat,yang,suara,lebih,cepat,banding,gambar,tambah,musik,sedikit,saja,bukan,lambat,cepat,jadi,nanti,hasil,imbang,gambar,suara",14,positive
688,Andi Doank,2,2023-11-23T10:14:01.000,Kenapa capcut mulai memburuk? Ada beberapa fitur yang tidak bisa digunakan padahal tidak pro. Tolong dong tingkat kan lagi kualitas Apk nya,"mulai,buruk,ada,yang,tidak,guna,tidak,tolong,tingkat,lagi,kualitas,aplikasi",-18,negative
689,Yoja 3454,5,2023-08-30T18:48:39.000,"Keren sekali!! apk ini bisa mengedit video berserta foto!!! Tapi..., bisakah saya req update nanti(1.Tambahin fitur opasitas foto,video,tex,overlay jadi nanti makin keren tex nya tembus pandang(2.Hilangin bug lag saat mencari template(3.hilangkan lag saat export video,biasanya export video atau foto kagak lag/frame sekarang mlah lag kadang juga fc(Force Close) Semoga kedepannya apk capcut makin keren cocok buat ram 2,3,4 dan gak lag, terus sukses..Capcut - Editor Video💪","sekali,aplikasi,serta,foto,saya,terbaru,jadi,nanti,makin,tembus,cari,foto,tidak,kadang,tutup,moga,aplikasi,makin,cocok,buat",5,positive
690,H1R0Mi,1,2023-08-05T18:07:42.000,"kok sekarang jadi jelek banget dah sekarang malah ga bisa buat ekspor video, terus kalo mau ganti foto, ekstrak audio, nambah overlay malah keluar keberanda. aku udah coba instal ulang berkali kali juga tetep sama dihpku, tolong diperbaiki secepatnya karna aplikasi ini sebenarnya bermanfaat buat kegiatan video dari tugas sekolah","jadi,jelek,sudah,tidak,buat,kalau,mau,ganti,foto,keluar,beranda,aku,sudah,coba,pasang,sama,tolong,baik,cepat,karena,aplikasi,benar,manfaat,buat,dari,tugas,sekolah",21,positive
691,Desintha,1,2023-10-03T14:53:01.000,"capcut kenapa deh sekarang kalo mau login ga bisa, udah dicoba beberapa kali sampa mau setengah jam tetep gabisa. padahal koneksi jaringan aman","kalau,mau,tidak,sudah,coba,mau,tengah,koneksi,jaringan",16,positive
692,salwa kirana,2,2023-08-16T17:25:10.000,"kenapa tetiba saya mau ekspor videonya jadi aga lebih membesar sendiri gt ya? tapi sebagian ada yg bgtu ada yg engga, tolong dong diperbaiki lagi, saya kira setelah update lebih bagus lagi, bagus tapi lemot dan suka nge bug sndri, tolong bgt secepatnya diperbaiki krna saya mau jg ekspor video² saya tentang teman², keluarga, crush sya.","tetiba,saya,mau,jadi,lebih,besar,sendiri,bagi,ada,yang,ada,yang,tolong,baik,lagi,saya,kira,terbaru,lebih,bagus,lagi,bagus,lot,suka,tolong,cepat,baik,karena,saya,mau,saya,tentang,keluarga",8,positive
693,sumaryo kebasen,1,2023-09-15T19:58:24.000,"Jeleekkkk mau masukin video tambahan malah keluar ke halaman utama, udah di coba puluhan kali masih ge jadi kalo mau ngedit jan pake aplikasi ini dulu cari aja aplikasi editing lain","mau,tambah,keluar,sudah,coba,jadi,kalau,mau,aplikasi,cari,saja,aplikasi,lain",-3,negative
694,TYO SYABANI,4,2023-09-15T17:43:40.000,Saya sudah mendownload capcut nya tapi malah engga bisa ngeleg tolong dong di perbaiki lagi ya sebenarnya udah bagus bisa di bikin status tetapi malah ya kaya gitu tolong ya di perbaiki lagi,"saya,sudah,tolong,baik,lagi,benar,sudah,bagus,kaya,tolong,baik,lagi",5,positive
695,Faiza Afroza,1,2023-11-18T22:16:10.000,Ini knp ga bisa login lagi ya? Templat nya juga ga mau muncul. Padahal sinyal wifi bagus2 aja,"tidak,lagi,tidak,mau,muncul,bagus,saja",-8,negative
696,Vira Vira,2,2023-11-17T12:03:26.000,"Maaf sebelumnya ko saya setiap mau ekspor atau pake template suka ngeleg ¹ kadang habis di ekspor gak adaa gambar nya malah ngeleg terus, perbaiki lagi dong kaya dulu🥺🙏🏻","maaf,saya,mau,suka,kadang,habis,gambar,baik,lagi,kaya",17,positive
697,Decha Aura,1,2023-11-25T09:00:38.000,Kenapa aplikasi nya jadi berubah ya sinyal ok wifi nya juga ok tapi di aplikasi cap cut punya ku ngak ada templet nya sampek ulang ngin donlowd nya sampek ada templet nya,"aplikasi,jadi,ok,ok,aplikasi,punya,tidak,ada,ada",7,positive
698,Muzaki Fahrul Hilmi,3,2023-11-16T10:30:07.000,"Sekarang lagi banyak bug nya, entah itu template nya error atau gak bisa search template, mohon segera di fix ini 🙏🏻","lagi,banyak,entah,itu,error,mohon,segera",-5,negative
699,Bilqueena Ramadhani Prabowo,5,2023-11-03T10:43:58.000,"Saya suka, tetapi kenapa saat mau di buat lagunya masih ada tetapi gambarnya melayang tapi tdk ap² saya tetap suka dan tolong di benarkan ya, saya tetap kasih bintang 5⭐️⭐️⭐️⭐️⭐️","saya,suka,mau,buat,lagu,ada,gambar,tidak,apa,saya,tetap,suka,tolong,benar,saya,tetap,kasih",11,positive
700,Wina Tasya,3,2023-11-01T15:16:28.000,"Banyak template yang gabisa dipake padahal sinyal bagus cuma loading itu suka gajelas kaya emang templatenya gabisa dipake, Pdhl templatenya bagus jadi kurang puas.","banyak,yang,bagus,cuma,itu,suka,kaya,bagus,jadi,kurang,puas",3,positive
701,Zainal Abdn,1,2023-09-23T18:31:42.000,Kok malah gini sih capcut setiap mau ganti foto enggak langsung di tempat yg habis di pilih mulai dari awal mending gak usah di update kalo malah bikin penggguna kecewa👎,"mau,ganti,foto,tidak,langsung,tempat,yang,habis,pilih,mulai,dari,awal,perlu,terbaru,kalau",7,positive
702,Aisyah Ranaa,2,2023-10-15T00:17:48.000,"Ini capcut kenapa makin kesini makin banyak bug nya?? Udah paling update, tapi videonya malah nge-glitch terus, mengganggu bangeetttt ampuuun","makin,makin,banyak,sudah,terbaru,ganggu",10,positive
703,Priscilla Cheryle,2,2023-10-01T12:09:32.000,"Aplikasinya bagus, tapi tolong diperbaiki seperti dulu, dulu kalau buat template itu mulus banget, kalau sekarang jadi patah patah dan nggak jelas","aplikasi,bagus,tolong,baik,seperti,kalau,buat,itu,mulus,kalau,jadi,patah,patah,tidak,jelas",-12,negative
704,Etty Andriaty,5,2023-09-30T20:21:11.000,"Bagus, tapi kadang grafiknya nge stuck nggak jelas gitu / nge bug gajelas tolong perbaikiin secepat nya takut ganggu applikasi ini..","bagus,kadang,tidak,jelas,tolong,cepat,takut,ganggu",-1,negative
705,Maz Toya,1,2023-10-20T18:34:57.000,"Kemarin habis update fitur pencarian template bisa, sekarang Fitur pencarian template eror lagi, tidak dapat dimuat. Tolong perbaiki 😪 , device saya samsung A23 4G","habis,terbaru,cari,cari,error,lagi,tidak,dapat,tolong,baik,saya",-12,negative
706,Naura Cutte,3,2023-10-01T12:08:15.000,"Kenapa selalu update,lumayan lag tapi untuk saya bikin konten yang bikin meresahkan nya MB saya sudah tidak muat Jd tolong yang update kali ini jangan update dan kalo update,update nya lagi nya aja di hapus jadi tolong di benarkah ya, terima kasih🙏","saya,yang,resah,saya,sudah,tidak,jadi,tolong,yang,terbaru,jangan,terbaru,kalau,lagi,saja,hapus,jadi,tolong,benar,terima,kasih",-24,negative
707,Nazla Aqilla,2,2023-11-21T15:47:57.000,"plis capcut kenapa makin updatte makin melonjak bug jy setiap buka cpccut iklan buanyak pol uuydh gitu bikin batre hp cpt habis tolong dong developer cpcutt untk di perbaiki tolong dong untuk di perbaiki masa di aku gk ada gambar ny bug nya sudah keterlaluan, dn tolong di jawab dan di perbaiki","tolong,makin,makin,buka,pol,baterai,habis,tolong,baik,tolong,baik,aku,tidak,ada,gambar,sudah,terlalu,tolong,jawab,baik",11,positive
708,Mulyati Ayu,5,2023-10-10T20:20:02.000,"Apk nya bagus cumann tolongg kalo misalnya mau ngedit itu Vidio nya selalu ngelag jadi harus di ekspor dulu tapi yang lainn nya okehh terimakasih untuk pembuat apk ini , dan apk ini sangat berguna untuk orang kayak creator atu dll sekali lagi terimakasihh 😊","aplikasi,bagus,kalau,mau,itu,jadi,harus,yang,terima kasih,buat,aplikasi,aplikasi,sangat,guna,kayak,sekali,lagi",-14,negative
709,DIMAS Mlbb,5,2023-08-21T22:09:16.000,"Assalamualaikum Devoloper Saya dari sumsel salken yah, di sini gw mau ngasih tau aja kalo apk capcut lebih di kembangkan lagi/di perbaiki karna masih banyak bug yg bikin resah pelanggan capcut, seperti bug (exstra)kadang² tdk ada suara,(exspor) kadang video yg udh kita edit tdk masuk ke files/gelery dan DLL masih banyak bug yg blom sy sampaikan tapi di sini saja, karna masih bnyk urusan yg lebih penting yg blom aku selesaikan, skian yg bisa sy sampaikan, terimakasih🥰🥰😍","assalamualaikum,saya,dari,saya,mau,tahu,saja,kalau,aplikasi,lebih,kembang,baik,karena,banyak,yang,resah,langgan,seperti,tidak,ada,kadang,yang,tidak,banyak,yang,saya,sampai,saja,karena,banyak,yang,lebih,penting,yang,aku,selesai,yang,saya,sampai,terima kasih",-24,negative
710,Ashar Ashar,1,2023-11-26T10:23:23.000,Kenapa pas mau cari template tertulis tidak dapat di muat.ketuk untuk mencoba lagi. Padahal bagus jaringan tolong dong,"pas,mau,cari,tidak,dapat,coba,lagi,bagus,jaringan,tolong",4,positive
711,deni barus,2,2023-11-25T15:08:42.000,Aplikasi nya sekarang gk enak banget di mainin ngelek bngt padahal kuota lancar terus pas mau buat video gk bisa bisa lama bngt,"aplikasi,tidak,enak,mainin,kuota,lancar,pas,mau,buat,tidak,lama",-4,negative
712,Nurdin Fvnky,5,2023-11-17T21:44:37.000,Mohon di perbaiki karna tidak bisa baca data audio dari penyimpanan internal... sebelumnya tidak seperti ini.. Tolong di perbaiki,"mohon,baik,karena,tidak,baca,data,dari,simpan,tidak,seperti,tolong,baik",-14,negative
713,Sofia Putri,5,2023-10-06T12:17:17.000,Aplikasinya cukup bagus dan Mudah mengerti untuk membuat video menjadi menarik tetapi Kadang kadang juga ngelag tanpa sebab dan Saya ingin agar Lag itu di Benarkan lagi,"aplikasi,cukup,bagus,mudah,erti,buat,jadi,tarik,kadang,kadang,sebab,saya,agar,itu,benar,lagi",3,positive
714,Feni Putri,5,2023-10-28T13:11:43.000,Saya suka pake aplikasi ini untuk edit video..tapi knpa skrg jika di buat status kok pecah² gambarnya yaa 😌😌 yang tau tlg kasih masukannya donk..trimakasih,"saya,suka,aplikasi,buat,gambar,yang,tahu,tolong,kasih",-2,negative
715,Pras Hadi,2,2023-10-10T10:06:47.000,Semakin kesini semakin parah! Mau ekspor hasil editan skr susah gara - gara iklan pinjol durasinya lama dan gak bisa di skip!,"makin,makin,parah,mau,hasil,susah,gara,gara,lama",-8,negative
716,Akank Bayu,5,2023-10-03T22:52:09.000,"Aplikasi yang sangat bagus, bisa memberikan inspirasi dari setiap kontennya, bisa membangkitkan semangat hidup kita berkat konten-konten yang sangat berfaedah, tingkatkan terus tim CapCut official","aplikasi,yang,sangat,bagus,beri,inspirasi,dari,bangkit,semangat,hidup,berkat,yang,sangat,faedah,tingkat,tim",0,neutral
717,Black Shadow,3,2023-11-24T07:51:06.000,"Setelah di update hasil video yang di ekspor jadi terpotong, tidak sesuai pada saat pengeditan video,","terbaru,hasil,yang,jadi,potong,tidak,sesuai,pada",-4,negative
718,Viewer X,5,2023-09-27T15:55:06.000,"Mantap edit mengedit video jd lebih mudah, fitur fitur pun sangat banyak. Very good. Yuk di coba","mantap,jadi,lebih,mudah,pun,sangat,banyak,sangat,bagus,yuk,coba",25,positive
719,Charisa Ramadhani,1,2023-10-26T23:59:50.000,"Saya benci aplikasi ini, padahal isinya nya sudah bagus tapi aplikasi nya ngebug Terus lemot jijik gue liat nya bisa ga sih nyiptain aplikasi tuh yg bagus ga ngelag"", nih aplikasi yg paling gue benci di play store sih","saya,benci,aplikasi,isi,sudah,bagus,aplikasi,lot,jijik,saya,lihat,tidak,aplikasi,yang,bagus,tidak,aplikasi,yang,saya,benci,main",-33,negative
720,Ravendra,1,2023-09-18T16:44:38.000,"Klo foto kehapus digaleri/platform lain, pasti ikut kehapus juga di edit, kan jdi susah dan kepaksa edit ulang. Tolong dong bkin animasi edit yg bener dkit. Tq","kalau,foto,hapus,lain,pasti,ikut,hapus,jadi,susah,paksa,tolong,yang,benar,terima kasih",-14,negative
721,Putri Damaiyanti,2,2023-11-15T23:56:20.000,Aplikasi makin di update makin jelek. Fitur pangkas gabisa digunakan seperti biasanya. Bukan upgrade tapi malah downgrade. Apa ada solusi?.,"aplikasi,makin,terbaru,makin,jelek,guna,seperti,biasa,bukan,apa,ada,solusi",2,positive
